url,name/title,address,price,area,price-per-area,floor/store,no of rooms,year of construction,parking space,market,form of ownership,condition,rent,heating,advertiser type,elevator,outdoor area,building type,building material
https://www.otodom.pl/pl/oferta/mieszkanie-3-pok-na-os-podwawelskim-ID4pFd7,Mieszkanie 3-pok. na os.Podwawelskim,"ul. Słomiana, Ludwinów, Dębniki, Kraków, małopolskie",855 000 zł,"57,6 m²",14 844 zł/m²,5/10,3,1975,,wtórny,pełna własność,do remontu,650 zł,miejskie,biuro nieruchomości,tak,,blok,wielka płyta
https://www.otodom.pl/pl/oferta/stare-debniki-57-m2-3-pok-0-prowizji-ID4pFdC,Stare Dębniki | 57 m2 | 3 pok | 0% PROWIZJI,"ul. Zamkowa 11, Dębniki, Dębniki, Kraków, małopolskie",1 097 000 zł,57 m²,19 246 zł/m²,1/2,3,brak informacji,,wtórny,pełna własność,do zamieszkania,500 zł,gazowe,biuro nieruchomości,nie,,kamienica,brak informacji
https://www.otodom.pl/pl/oferta/m3-w-swietnej-lokalizacji-os-podwawelskie-slomiana-ID4pHMz,M3 w świetnej lokalizacji os.Podwawelskie/Słomiana,"Ludwinów, Dębniki, Kraków, małopolskie",930 400 zł,57 m²,16 323 zł/m²,8/10,3,brak informacji,garaż/miejsce parkingowe,wtórny,,do zamieszkania,,,biuro nieruchomości,tak,balkon,brak informacji,brak informacji
https://www.otodom.pl/pl/oferta/wykonczone-3-pokoje-jasna-kuchnia-balkon-ID4pHQl,"Wykończone, 3 pokoje, jasna kuchnia, balkon","Osiedle Tysiąclecia, Mistrzejowice, Mistrzejowice, Kraków, małopolskie",850 000 zł,56 m²,15 179 zł/m²,2/10,3,1980,garaż/miejsce parkingowe,wtórny,pełna własność,do zamieszkania,,miejskie,biuro nieruchomości,tak,balkon,blok,brak informacji
https://www.otodom.pl/pl/oferta/mieszkanie-dwupokojowe-os-na-stoku-ID4pHQy,Mieszkanie dwupokojowe os. Na stoku,"os. Na Stoku, Wzgórza Krzesławickie, Wzgórza Krzesławickie, Kraków, małopolskie",570 000 zł,40 m²,14 250 zł/m²,parter/3,2,1960,,wtórny,pełna własność,do wykończenia,,miejskie,biuro nieruchomości,nie,,blok,brak informacji
https://www.otodom.pl/pl/oferta/kawalerka-gotowa-do-zamieszkania-ID4pHTt,Kawalerka gotowa do zamieszkania,"Złocień, Bieżanów-Prokocim, Kraków, małopolskie",440 000 zł,"30,1 m²",14 618 zł/m²,parter/3,1,2001,,wtórny,pełna własność,do zamieszkania,331 zł,elektryczne,prywatny,nie,,blok,cegła
https://www.otodom.pl/pl/oferta/centrum-z-ogrodkiem-2-pokoje-rabat-125-tys-ID4pHRr,Centrum z ogródkiem 2 pokoje Rabat 125 tys.!!!!!,"ul. Rydlówka, Stare Podgórze, Podgórze, Kraków, małopolskie",717 144 zł,"39,84 m²",18 001 zł/m²,parter/5,2,2024,,pierwotny,,,,,biuro nieruchomości,nie,"ogródek, taras",brak informacji,brak informacji
https://www.otodom.pl/pl/oferta/krakow-ul-bochenka-54-m2-dwa-balkony-ID4pA5p,Kraków ul. Bochenka - 54 m2 dwa balkony,"ul. Adama Bochenka, Piaski Wielkie, Podgórze Duchackie, Kraków, małopolskie",699 000 zł,54 m²,12 944 zł/m²,10/10,2,2013,garaż/miejsce parkingowe,wtórny,pełna własność,do zamieszkania,550 zł,miejskie,biuro nieruchomości,tak,balkon,blok,pustak
https://www.otodom.pl/pl/oferta/komfortowe-3-pokoje-balkon-m-garazowe-komorka-ID4pGxc,Komfortowe 3 pokoje | balkon| m.garażowe+ komórka,"Bieńczyce, Bieńczyce, Kraków, małopolskie",850 000 zł,"54,47 m²",15 605 zł/m²,1/7,3,2012,garaż/miejsce parkingowe,wtórny,pełna własność,do zamieszkania,,miejskie,biuro nieruchomości,tak,balkon,blok,pustak
https://www.otodom.pl/pl/oferta/2-pokojowe-mieszkanie-39m2-ogrodek-bezposrednio-ID4pcGS,2-pokojowe mieszkanie 39m2 + ogródek Bezpośrednio,"ul. Składowa, Krowodrza, Krowodrza, Kraków, małopolskie",676 260 zł,"39,78 m²",17 000 zł/m²,parter/4,2,,garaż/miejsce parkingowe,,pełna własność,do wykończenia,,,,,ogródek,,
https://www.otodom.pl/pl/oferta/lepkowskiego-mieszkanie-3-pok-11-m39-ID4pwtu,Łepkowskiego | mieszkanie 3-pok. | 11 / M39,"ul. Józefa Łepkowskiego, Prądnik Czerwony, Prądnik Czerwony, Kraków, małopolskie",1 173 975 zł,"71,15 m²",16 500 zł/m²,5/6,3,,garaż/miejsce parkingowe,,pełna własność,do wykończenia,,inne,,,taras,,
https://www.otodom.pl/pl/oferta/dwupoziomowy-apartament-2-miejsca-postojowe-gaik-ID4pxRx,Dwupoziomowy apartament|2 miejsca postojowe | Gaik,"Tonie, Prądnik Biały, Kraków, małopolskie",1 449 000 zł,"102,02 m²",14 203 zł/m²,1/2,4,2016,garaż/miejsce parkingowe,wtórny,pełna własność,do zamieszkania,468 zł,gazowe,biuro nieruchomości,nie,balkon,brak informacji,pustak
https://www.otodom.pl/pl/oferta/wykonczone-3-pok-prywatnie-bez-pcc-wieliczka-ID4pMZ7,Wykończone//3-pok// Prywatnie//Bez PCC//Wieliczka,"ul. Potrzask, Wieliczka, Wieliczka, wielicki, małopolskie",839 000 zł,69 m²,12 159 zł/m²,3/3,3,2023,garaż/miejsce parkingowe,wtórny,pełna własność,do zamieszkania,600 zł,gazowe,prywatny,nie,balkon,blok,brak informacji
https://www.otodom.pl/pl/oferta/swietna-inwestycja-super-mieszkanie-ID4pNlo,Świetna inwestycja! Super mieszkanie!!!,"Ruczaj, Dębniki, Kraków, małopolskie",577 000 zł,34 m²,16 971 zł/m²,parter/3,2,2025,garaż/miejsce parkingowe,pierwotny,pełna własność,,,inne,biuro nieruchomości,tak,ogródek,blok,brak informacji
https://www.otodom.pl/pl/oferta/pachonskiego-nowe-3-pokojowe-balkon-tramwaj-ID4pNf0,Pachońskiego Nowe 3-pokojowe balkon tramwaj,"Prądnik Biały, Prądnik Biały, Kraków, małopolskie",749 000 zł,48 m²,15 604 zł/m²,5/7,3,2023,garaż/miejsce parkingowe,wtórny,pełna własność,do wykończenia,,miejskie,biuro nieruchomości,tak,balkon,apartamentowiec,cegła
https://www.otodom.pl/pl/oferta/2-pokoje-wieliczka-potrzask-ID4oUDC,2 pokoje|Wieliczka|Potrzask,"Bieżanów, Bieżanów-Prokocim, Kraków, małopolskie",465 000 zł,"41,72 m²",11 146 zł/m²,2/4,2,2025,,pierwotny,spółdzielcze wł. prawo do lokalu,do wykończenia,,gazowe,prywatny,tak,balkon,blok,inny
https://www.otodom.pl/pl/oferta/kawalerka-z-balkonem-w-sasiedztwie-bulwarow-ID4pNiF,Kawalerka z Balkonem w sąsiedztwie Bulwarów,"ul. Na Ustroniu, Ludwinów, Dębniki, Kraków, małopolskie",719 670 zł,"31,29 m²",23 000 zł/m²,parter/5,1,2022,,pierwotny,,,,,biuro nieruchomości,nie,,brak informacji,brak informacji
https://www.otodom.pl/pl/oferta/zamieszkaj-na-parkowej-w-starym-podgorzu-ID4pN20,Zamieszkaj na Parkowej w Starym Podgórzu,"ul. Parkowa 16B, Stare Podgórze, Podgórze, Kraków, małopolskie",920 000 zł,"41,02 m²",22 428 zł/m²,3/3,2,2015,garaż/miejsce parkingowe,wtórny,pełna własność,do zamieszkania,530 zł,miejskie,biuro nieruchomości,tak,balkon,blok,pustak
https://www.otodom.pl/pl/oferta/kawalerka-w-nowej-hucie-os-zielone-ID4pN8s,Kawalerka w Nowej Hucie - os. Zielone,"Nowa Huta, Nowa Huta, Kraków, małopolskie",315 000 zł,18 m²,17 500 zł/m²,2/2,1,1950,,wtórny,pełna własność,do wykończenia,242 zł,miejskie,biuro nieruchomości,nie,,blok,cegła
https://www.otodom.pl/pl/oferta/mieszkanie-4-pok-podgorze-77m2-ID4p9Cl,Mieszkanie 4 pok. |Podgórze | 77m2,"ul. Stanisława Klimeckiego, Zabłocie, Podgórze, Kraków, małopolskie",1 489 000 zł,77 m²,19 338 zł/m²,1/6,4,2023,garaż/miejsce parkingowe,wtórny,pełna własność,do zamieszkania,800 zł,miejskie,biuro nieruchomości,tak,balkon,blok,brak informacji
https://www.otodom.pl/pl/oferta/mieszkanie-4-pokojowe-w-samym-centrum-do-remontu-ID4p3DA,Mieszkanie 4 Pokojowe w samym Centrum |Do remontu,"ul. Krowoderska, Kleparz, Stare Miasto, Kraków, małopolskie",2 200 000 zł,"133,35 m²",16 498 zł/m²,3/3,4,1914,,wtórny,pełna własność,do remontu,1 000 zł,,biuro nieruchomości,nie,,kamienica,cegła
https://www.otodom.pl/pl/oferta/3-pokoje-wieliczka-bez-pcc-ID4meTh,3 pokoje | Wieliczka | BEZ PCC ! |,"ul. Jaworowa, Wieliczka, Wieliczka, wielicki, małopolskie",559 000 zł,"52,9 m²",10 567 zł/m²,2/4,3,2022,garaż/miejsce parkingowe,pierwotny,pełna własność,do wykończenia,500 zł,gazowe,biuro nieruchomości,tak,balkon,blok,brak informacji
https://www.otodom.pl/pl/oferta/jasne-3-pok-mieszkanie-z-balkonem-2-parkingi-ID4pGqo,Jasne 3 pok. mieszkanie z balkonem 2 PARKINGI!,"ul. Macieja Dębskiego, Opatkowice, Swoszowice, Kraków, małopolskie",730 000 zł,54 m²,13 519 zł/m²,2/3,3,2014,,wtórny,pełna własność,do zamieszkania,500 zł,gazowe,prywatny,nie,balkon,blok,brak informacji
https://www.otodom.pl/pl/oferta/2-pok-42-m2-stare-miasto-winda-balkon-do-wprowadze-ID4pGsO,2 POK 42 m2 STARE MIASTO winda balkon do wprowadze,"al. 29 Listopada, Przedmieście Warszawskie, Stare Miasto, Kraków, małopolskie",799 000 zł,"42,7 m²",18 712 zł/m²,3/9,2,2018,,wtórny,pełna własność,do zamieszkania,500 zł,miejskie,biuro nieruchomości,tak,"balkon, taras",apartamentowiec,żelbet
https://www.otodom.pl/pl/oferta/faktoria-mlyn-mieszkanie-3-pok-b4-p0-m10-ID4kDHT,Faktoria Młyn | mieszkanie 3-pok. | B4.P0.M10,"ul. Kocmyrzowska, Bieńczyce, Bieńczyce, Kraków, małopolskie",877 184 zł,"58,37 m²",15 028 zł/m²,parter/3,3,2024,,pierwotny,pełna własność,do wykończenia,,,deweloper,nie,ogródek,brak informacji,brak informacji
https://www.otodom.pl/pl/oferta/lepkowskiego-mieszkanie-2-pok-11-m31-ID4pwty,Łepkowskiego | mieszkanie 2-pok. | 11 / M31,"ul. Józefa Łepkowskiego, Prądnik Czerwony, Prądnik Czerwony, Kraków, małopolskie",756 700 zł,47 m²,16 100 zł/m²,3/6,2,,garaż/miejsce parkingowe,,pełna własność,do wykończenia,,inne,,,balkon,,
https://www.otodom.pl/pl/oferta/urzadzone-mieszkanie-2-pokoje-gorka-narodowa-ID4pAuL,"Urządzone mieszkanie, 2 pokoje, Górka Narodowa!","Górka Narodowa, Prądnik Biały, Kraków, małopolskie",675 000 zł,"41,42 m²",16 296 zł/m²,1/10,2,2018,,wtórny,,do zamieszkania,,,biuro nieruchomości,tak,,apartamentowiec,brak informacji
https://www.otodom.pl/pl/oferta/dwupoziomowe-przestronne-mieszkanie-armii-krajowej-ID4pJeR,"Dwupoziomowe,przestronne mieszkanie|Armii Krajowej","ul. Odlewnicza, Małe Błonia, Krowodrza, Kraków, małopolskie",1 599 000 zł,"147,84 m²",10 816 zł/m²,1/2,5,2023,garaż/miejsce parkingowe,pierwotny,pełna własność,do wykończenia,506 zł,inne,prywatny,nie,balkon,dom wolnostojący,żelbet
https://www.otodom.pl/pl/oferta/idealne-dla-pary-lub-pod-inwestycje-ID4pzcD,Idealne dla pary lub pod inwestycję,"ul. Dobrego Pasterza, Prądnik Czerwony, Prądnik Czerwony, Kraków, małopolskie",799 000 zł,"44,71 m²",17 871 zł/m²,> 10/11,2,brak informacji,garaż/miejsce parkingowe,wtórny,pełna własność,do zamieszkania,,miejskie,biuro nieruchomości,tak,,blok,wielka płyta
https://www.otodom.pl/pl/oferta/idealne-pod-wynajem-ID4pJmJ,Idealne pod wynajem,"ul. Rydlówka, Stare Podgórze, Podgórze, Kraków, małopolskie",936 993 zł,"51,55 m²",18 176 zł/m²,3/5,3,2024,,pierwotny,pełna własność,do wykończenia,,miejskie,biuro nieruchomości,tak,balkon,blok,pustak
https://www.otodom.pl/pl/oferta/rozkladowe-m2-duzy-balkon-cicha-okolica-ID4pF7R,Rozkładowe M2 | Duży balkon | Cicha okolica,"Łęg, Czyżyny, Kraków, małopolskie",640 000 zł,40 m²,16 000 zł/m²,2/6,2,2017,garaż/miejsce parkingowe,wtórny,pełna własność,do zamieszkania,450 zł,miejskie,biuro nieruchomości,tak,balkon,apartamentowiec,pustak
https://www.otodom.pl/pl/oferta/bronowice-radzikowskiego-4-pok-70m2-eng-ID4pJ8u,Bronowice | Radzikowskiego | 4 Pok | 70m2 | Eng,"ul. Eljasza Walerego Radzikowskiego, Azory, Prądnik Biały, Kraków, małopolskie",1 169 000 zł,70 m²,16 700 zł/m²,5/5,4,2017,garaż/miejsce parkingowe,wtórny,pełna własność,do zamieszkania,,miejskie,biuro nieruchomości,tak,balkon,apartamentowiec,brak informacji
https://www.otodom.pl/pl/oferta/1m-kawalerka-z-duzym-potencjalem-do-remontu-ID4pJaK,1M | Kawalerka z dużym potencjałem | Do remontu!,"Bieńczyce, Bieńczyce, Kraków, małopolskie",399 000 zł,24 m²,16 625 zł/m²,10/10,1,brak informacji,,wtórny,pełna własność,do remontu,350 zł,miejskie,biuro nieruchomości,tak,,blok,wielka płyta
https://www.otodom.pl/pl/oferta/mieszkanie-inwestycyjne-ny-residence-wroclawska-ID4prh6,Mieszkanie inwestycyjne | Ny Residence Wrocławska,"ul. Wrocławska, Krowodrza, Krowodrza, Kraków, małopolskie",579 000 zł,"24,15 m²",23 975 zł/m²,parter/6,1,2018,,wtórny,pełna własność,do zamieszkania,380 zł,miejskie,biuro nieruchomości,tak,taras,apartamentowiec,inny
https://www.otodom.pl/pl/oferta/urzadzona-kawalerka-ogrod-walerego-slawka-ID4pkXK,URZĄDZONA kawalerka | ogród | Walerego Sławka,"ul. Walerego Sławka, Wola Duchacka, Podgórze Duchackie, Kraków, małopolskie",309 000 zł,21 m²,14 714 zł/m²,parter/3,1,brak informacji,,wtórny,udział,do zamieszkania,200 zł,gazowe,prywatny,nie,ogródek,blok,cegła
https://www.otodom.pl/pl/oferta/swiezo-wykonczone-m-szuka-nowego-wlasciciela-ID4pFUi,Świeżo wykończone M szuka nowego właściciela,"os. Albertyńskie, Bieńczyce, Bieńczyce, Kraków, małopolskie",660 000 zł,"40,42 m²",16 329 zł/m²,parter/4,2,1963,garaż/miejsce parkingowe,wtórny,pełna własność,do zamieszkania,560 zł,miejskie,biuro nieruchomości,nie,balkon,blok,cegła
https://www.otodom.pl/pl/oferta/klimatyczne-m3-w-kamienicy-przy-nowym-kleparzu-ID4pG1l,Klimatyczne M3 w kamienicy przy Nowym Kleparzu,"Krowodrza, Krowodrza, Kraków, małopolskie",1 391 000 zł,"69,6 m²",19 986 zł/m²,3/3,3,1950,,wtórny,pełna własność,do zamieszkania,360 zł,gazowe,prywatny,nie,balkon,kamienica,cegła
https://www.otodom.pl/pl/oferta/lepkowskiego-mieszkanie-3-pok-11-m09-ID4pwtx,Łepkowskiego | mieszkanie 3-pok. | 11 / M09,"ul. Józefa Łepkowskiego, Prądnik Czerwony, Prądnik Czerwony, Kraków, małopolskie",995 851 zł,"63,43 m²",15 700 zł/m²,1/6,3,,garaż/miejsce parkingowe,,pełna własność,do wykończenia,,inne,,,balkon,,
https://www.otodom.pl/pl/oferta/stachiewicza-pietro-4-4-2pok-37m2-piwnica-3m2-ID4pG4V,"Stachiewicza - piętro 4/4, 2pok.,37m2+piwnica 3m2","Azory, Azory, Prądnik Biały, Kraków, małopolskie",549 999 zł,37 m²,14 865 zł/m²,4/4,2,1985,,wtórny,pełna własność,do zamieszkania,1 zł,miejskie,biuro nieruchomości,nie,,blok,wielka płyta
https://www.otodom.pl/pl/oferta/wyjatkowy-apartament-z-tarasem-20m2-centrum-ID4pIzA,Wyjątkowy apartament z tarasem 20m2/Centrum,"ul. Szlak, Kleparz, Stare Miasto, Kraków, małopolskie",818 000 zł,29 m²,28 207 zł/m²,6/6,1,2009,,wtórny,,do zamieszkania,500 zł,miejskie,biuro nieruchomości,tak,,apartamentowiec,inny
https://www.otodom.pl/pl/oferta/trzypokojowe-z-balkonem-al-pokoju-ID4pIzQ,"Trzypokojowe z balkonem, al. Pokoju","Czyżyny, Czyżyny, Kraków, małopolskie",813 834 zł,"43,06 m²",18 900 zł/m²,3/5,3,2022,,wtórny,,,,,biuro nieruchomości,tak,balkon,apartamentowiec,beton komórkowy
https://www.otodom.pl/pl/oferta/park-lotnikow-grzegorzki-3-pokoje-ogrod-ID4pHQP,Park Lotników | Grzegórzki | 3 pokoje | ogród,"ul. Stanisława Lema, Czyżyny, Czyżyny, Kraków, małopolskie",1 270 000 zł,52 m²,24 423 zł/m²,,3,2023,garaż/miejsce parkingowe,pierwotny,pełna własność,do zamieszkania,350 zł,miejskie,biuro nieruchomości,tak,ogródek,blok,brak informacji
https://www.otodom.pl/pl/oferta/dwupokojowe-z-balkonem-al-pokoju-ID4pIzS,Dwupokojowe z balkonem al. Pokoju,"Czyżyny, Czyżyny, Kraków, małopolskie",754 210 zł,"37,9 m²",19 900 zł/m²,1/5,2,2022,,wtórny,,,,,biuro nieruchomości,tak,balkon,apartamentowiec,beton komórkowy
https://www.otodom.pl/pl/oferta/emaus-garden-apartament-b6-a2-ID4k3w3,Emaus Garden | apartament B6_A2,"ul. Piotra Borowego, Zwierzyniec, Zwierzyniec, Kraków, małopolskie",Zapytaj o cenę,"44,87 m²",,parter/1,2,,garaż/miejsce parkingowe,,pełna własność,do wykończenia,,,,,"ogródek, taras",,
https://www.otodom.pl/pl/oferta/kawalerka-rakowicka-centrum-pod-wynajem-ID4kHaF,"Kawalerka, Rakowicka - Centrum, Pod wynajem.","ul. Rakowicka, Osiedle Oficerskie, Grzegórzki, Kraków, małopolskie",555 000 zł,"33,02 m²",16 808 zł/m²,parter/2,1,1998,garaż/miejsce parkingowe,wtórny,pełna własność,do zamieszkania,300 zł,,biuro nieruchomości,nie,,brak informacji,brak informacji
https://www.otodom.pl/pl/oferta/gotowy-luksusowy-blizniak-duzy-taras-promocja-ID4lIz1,"Gotowy Luksusowy Bliźniak, Duży taras, Promocja","ul. Wiosenna, Chełm, Zwierzyniec, Kraków, małopolskie",2 024 464 zł,"124,45 m²",16 267 zł/m²,parter/1,4,2023,,pierwotny,,do wykończenia,,,biuro nieruchomości,nie,"balkon, taras",dom wolnostojący,inny
https://www.otodom.pl/pl/oferta/kawalerka-garden-residence-balkon-komorka-mpk-ID4pIZa,"kawalerka, Garden Residence, balkon, Komorka, Mpk","ul. Przemysłowa, Zabłocie, Podgórze, Kraków, małopolskie",798 000 zł,34 m²,23 471 zł/m²,3/4,1,2013,,wtórny,pełna własność,do zamieszkania,,miejskie,biuro nieruchomości,tak,balkon,blok,brak informacji
https://www.otodom.pl/pl/oferta/trzy-pokoje-ruczaj-ID4pIZf,Trzy pokoje Ruczaj,"Ruczaj, Dębniki, Kraków, małopolskie",856 650 zł,"57,11 m²",15 000 zł/m²,parter/3,3,2023,garaż/miejsce parkingowe,wtórny,,,,miejskie,biuro nieruchomości,tak,,brak informacji,brak informacji
https://www.otodom.pl/pl/oferta/mieszkanie-z-ogrodkiem-48m2-zwierzyniec-ID4pJ01,"Mieszkanie z ogródkiem, 48m2, Zwierzyniec","Przegorzały, Zwierzyniec, Kraków, małopolskie",699 000 zł,"48,02 m²",14 556 zł/m²,parter/3,3,2025,,pierwotny,pełna własność,do wykończenia,,gazowe,biuro nieruchomości,nie,"balkon, ogródek, taras",dom wolnostojący,pustak
https://www.otodom.pl/pl/oferta/kawalerka-na-kazimierzu-ul-kordeckiego-eng-ID4pJ4G,"Kawalerka na Kazimierzu, ul. Kordeckiego Eng","Kazimierz, Stare Miasto, Kraków, małopolskie",410 000 zł,"23,98 m²",17 098 zł/m²,4/4,1,1900,,wtórny,,do zamieszkania,200 zł,elektryczne,biuro nieruchomości,nie,,kamienica,cegła
https://www.otodom.pl/pl/oferta/3-pokoje-do-wejscia-balkon-komorka-mpk-ID4pKr3,"3 pokoje, do wejścia, balkon, komórka, Mpk","ul. Wielicka, Kabel, Podgórze, Kraków, małopolskie",997 600 zł,"68,8 m²",14 500 zł/m²,parter/6,3,2013,garaż/miejsce parkingowe,wtórny,pełna własność,do zamieszkania,700 zł,miejskie,biuro nieruchomości,tak,balkon,blok,brak informacji
https://www.otodom.pl/pl/oferta/nowe-2-pokojowe-wysoki-standard-wykonczenia-ID4pKsI,"Nowe, 2 pokojowe, wysoki standard wykończenia","ul. Sołtysowska, Łęg, Czyżyny, Kraków, małopolskie",669 000 zł,"32,36 m²",20 674 zł/m²,2/5,2,2023,,pierwotny,,do zamieszkania,268 zł,miejskie,biuro nieruchomości,tak,balkon,brak informacji,brak informacji
https://www.otodom.pl/pl/oferta/bronowice-przestronne-mieszkanie-przy-tramwaju-ID4pyaR,Bronowice - Przestronne mieszkanie przy tramwaju.,"ul. Bolesława Wallek-Walewskiego, Bronowice, Bronowice, Kraków, małopolskie",689 000 zł,"53,47 m²",12 886 zł/m²,3/3,2,1970,,wtórny,pełna własność,do zamieszkania,,gazowe,biuro nieruchomości,nie,,kamienica,cegła
https://www.otodom.pl/pl/oferta/widokowe-komfortowe-3pok-parking-ochrona-klima-ID4pO5N,Widokowe komfortowe 3pok parking ochrona Klima,"Krowodrza Górka, Prądnik Biały, Kraków, małopolskie",1 238 700 zł,60 m²,20 645 zł/m²,6/6,3,2018,garaż/miejsce parkingowe,wtórny,pełna własność,do zamieszkania,700 zł,miejskie,biuro nieruchomości,tak,balkon,apartamentowiec,cegła
https://www.otodom.pl/pl/oferta/2m-i-balkon-i-blisko-kazimierz-i-rynek-i-centrum-i-ID4pD5O,2M I Balkon I Blisko Kazimierz I Rynek I Centrum I,"Grzegórzki, Grzegórzki, Kraków, małopolskie",650 000 zł,40 m²,16 250 zł/m²,2/6,2,1960,,wtórny,pełna własność,do remontu,370 zł,miejskie,biuro nieruchomości,tak,balkon,blok,cegła
https://www.otodom.pl/pl/oferta/2m-po-remoncie-zalew-nowohucki-mpk-ID4pFAu,2M! po remoncie | Zalew Nowohucki | MPK!,"Nowa Huta, Nowa Huta, Kraków, małopolskie",680 000 zł,"47,2 m²",14 407 zł/m²,2/4,2,1958,,wtórny,,do zamieszkania,670 zł,miejskie,biuro nieruchomości,nie,balkon,blok,brak informacji
https://www.otodom.pl/pl/oferta/faktoria-mlyn-mieszkanie-3-pok-b4-p0-m9-ID4kDHP,Faktoria Młyn | mieszkanie 3-pok. | B4.P0.M9,"ul. Kocmyrzowska, Bieńczyce, Bieńczyce, Kraków, małopolskie",927 718 zł,"60,56 m²",15 319 zł/m²,parter/3,3,2024,,pierwotny,pełna własność,do wykończenia,,,deweloper,nie,ogródek,brak informacji,brak informacji
https://www.otodom.pl/pl/oferta/mieszkanie-z-komorka-lokatorska-i-tarasem-ID4pO8H,Mieszkanie z komórką lokatorską i tarasem,"ul. Franciszka Bohomolca, Mistrzejowice, Mistrzejowice, Kraków, małopolskie",1 070 000 zł,"65,13 m²",16 429 zł/m²,parter/7,3,2018,garaż/miejsce parkingowe,wtórny,pełna własność,do zamieszkania,630 zł,miejskie,prywatny,tak,"balkon, ogródek, taras",blok,brak informacji
https://www.otodom.pl/pl/oferta/3-pokoje-68m-kliny-2-balkony-okazja-ID4pO9T,3 pokoje 68m Kliny - 2 balkony OKAZJA!!!,"ul. Komuny Paryskiej, Kliny, Swoszowice, Kraków, małopolskie",849 000 zł,68 m²,12 485 zł/m²,1/4,3,2020,garaż/miejsce parkingowe,wtórny,pełna własność,do zamieszkania,650 zł,miejskie,biuro nieruchomości,tak,balkon,blok,pustak
https://www.otodom.pl/pl/oferta/przytulne-na-najwyzszym-pietrze-kazimierz-ID4pObd,"Przytulne na najwyższym piętrze, Kazimierz","ul. Starowiślna, Kazimierz, Stare Miasto, Kraków, małopolskie",840 350 zł,"34,3 m²",24 500 zł/m²,6/6,2,2018,,wtórny,pełna własność,do zamieszkania,500 zł,miejskie,biuro nieruchomości,tak,,apartamentowiec,brak informacji
https://www.otodom.pl/pl/oferta/bielany-mieszkanie-przy-lesie-2-garaze-komorka-ID4pd6i,"Bielany, mieszkanie przy lesie, 2 garaże, komórka","ul. Księcia Józefa, Bielany, Zwierzyniec, Kraków, małopolskie",1 260 000 zł,93 m²,13 548 zł/m²,2/3,3,2005,garaż/miejsce parkingowe,wtórny,pełna własność,do zamieszkania,650 zł,gazowe,biuro nieruchomości,nie,balkon,blok,cegła
https://www.otodom.pl/pl/oferta/3-pokojowe-z-tarasem-i-ogrodem-w-centrum-ID4pOeo,3 pokojowe z tarasem i ogrodem w centrum,"ul. Wielicka, Stare Podgórze, Podgórze, Kraków, małopolskie",1 110 000 zł,"55,66 m²",19 943 zł/m²,parter/3,3,2017,garaż/miejsce parkingowe,wtórny,pełna własność,do zamieszkania,798 zł,miejskie,prywatny,tak,"balkon, ogródek, taras",blok,silikat
https://www.otodom.pl/pl/oferta/ul-bochenka-balkon-m-postojowe-ID4pBob,Ul. Bochenka / Balkon / M. Postojowe,"ul. Adama Bochenka, Piaski Wielkie, Podgórze Duchackie, Kraków, małopolskie",591 500 zł,35 m²,16 900 zł/m²,5/11,1,2013,garaż/miejsce parkingowe,wtórny,,do zamieszkania,479 zł,miejskie,biuro nieruchomości,tak,balkon,blok,pustak
https://www.otodom.pl/pl/oferta/kawalerka-z-ogrodem-ul-obozowa-ID4pBqB,"Kawalerka z ogrodem, ul. Obozowa","ul. Obozowa, Ruczaj, Dębniki, Kraków, małopolskie",530 000 zł,29 m²,18 276 zł/m²,parter/3,1,2014,,wtórny,,do zamieszkania,,miejskie,prywatny,nie,ogródek,blok,brak informacji
https://www.otodom.pl/pl/oferta/wyjatkowo-piekne-mieszkanie-po-generalnym-remoncie-ID4pBrr,Wyjątkowo piękne mieszkanie po generalnym remoncie,"ul. Włoska, Wola Duchacka, Podgórze Duchackie, Kraków, małopolskie",799 000 zł,57 m²,14 018 zł/m²,2/10,3,brak informacji,,wtórny,pełna własność,do zamieszkania,,miejskie,biuro nieruchomości,tak,balkon,blok,wielka płyta
https://www.otodom.pl/pl/oferta/swietny-rozklad-i-3-pokoje-i-po-gen-remoncie-ID4pByZ,Świetny rozkład I 3 pokoje I po gen. remoncie,"ul. Jakuba Bojki, Kurdwanów, Podgórze Duchackie, Kraków, małopolskie",689 000 zł,"48,7 m²",14 148 zł/m²,parter/4,3,1987,,wtórny,pełna własność,do zamieszkania,800 zł,miejskie,biuro nieruchomości,nie,balkon,blok,wielka płyta
https://www.otodom.pl/pl/oferta/3pok-kuchnia-46m2-os-albertynskie-czyzyny-ID4pBD9,"3pok. + kuchnia | 46m2 | Os. Albertyńskie, Czyżyny","Bieńczyce, Bieńczyce, Kraków, małopolskie",540 000 zł,46 m²,11 739 zł/m²,4/4,3,1962,,wtórny,,,543 zł,miejskie,biuro nieruchomości,nie,balkon,blok,wielka płyta
https://www.otodom.pl/pl/oferta/60-metrow-blisko-dworca-gl-i-galerii-krakowskiej-ID4pyaD,60 metrów blisko dworca gł. i Galerii Krakowskiej,"ul. Rogatka 1, Przedmieście Warszawskie, Stare Miasto, Kraków, małopolskie",598 000 zł,60 m²,9 967 zł/m²,4/4,2,2006,,wtórny,pełna własność,,250 zł,gazowe,prywatny,nie,,kamienica,brak informacji
https://www.otodom.pl/pl/oferta/117-m2-duzy-ogrod-92m2-dom-wola-justowska-ID4p12i,117 m2 + duży ogród 92m2 dom Wola Justowska,"ul. Wiosenna, Chełm, Zwierzyniec, Kraków, małopolskie",2 041 000 zł,"116,7 m²",17 489 zł/m²,,5,brak informacji,,pierwotny,,,,,biuro nieruchomości,nie,ogródek,brak informacji,brak informacji
https://www.otodom.pl/pl/oferta/nowe-mieszkanie-w-sercu-starego-podgorza-balkon-ID4pLEa,Nowe Mieszkanie w sercu Starego Podgórza - balkon,"ul. Kalwaryjska 34, Stare Podgórze, Podgórze, Kraków, małopolskie",796 380 zł,"40,84 m²",19 500 zł/m²,4/4,2,2023,,pierwotny,pełna własność,do wykończenia,550 zł,miejskie,biuro nieruchomości,tak,balkon,kamienica,pustak
https://www.otodom.pl/pl/oferta/dwa-pokoje-kuchnia-na-zabincu-ID4pLey,dwa pokoje + kuchnia na Żabińcu,"ul. Ludwika Solskiego, Żabiniec, Prądnik Biały, Kraków, małopolskie",869 000 zł,59 m²,14 729 zł/m²,5/5,2,brak informacji,,wtórny,pełna własność,do zamieszkania,713 zł,miejskie,biuro nieruchomości,nie,balkon,blok,brak informacji
https://www.otodom.pl/pl/oferta/jasne-mieszkanie-44-m2-przy-ul-wroclawska-53-ID4p2a3,Jasne mieszkanie 44 m2 przy ul. Wrocławska 53,"ul. Wrocławska, Krowodrza, Krowodrza, Kraków, małopolskie",860 000 zł,44 m²,19 545 zł/m²,4,2,brak informacji,garaż/miejsce parkingowe,wtórny,pełna własność,do zamieszkania,600 zł,miejskie,biuro nieruchomości,tak,balkon,brak informacji,brak informacji
https://www.otodom.pl/pl/oferta/funkcjonalne-2-pok-mieszkanie-40-4-m2-ul-sikorki-ID4pvYs,Funkcjonalne 2-pok. mieszkanie 40.4 m2 ul. Sikorki,"ul. Sikorki, Łęg, Czyżyny, Kraków, małopolskie",670 000 zł,"40,41 m²",16 580 zł/m²,1,2,2018,,wtórny,,do zamieszkania,,miejskie,biuro nieruchomości,tak,balkon,blok,brak informacji
