url,name/title,address,price,area,price-per-area,floor/store,no of rooms,year of construction,parking space,market,form of ownership,condition,rent,heating,advertiser type,elevator,outdoor area,building type,building material
https://www.otodom.pl/pl/oferta/zlocien-piekne-3-pok-z-tarasem-i-miejscem-w-garazu-ID4peUa,Złocień-piękne 3 pok z tarasem i miejscem w garażu,"ul. Henryka i Karola Czeczów, Złocień, Bieżanów-Prokocim, Kraków, małopolskie",799 000 zł,"64,74 m²",12 342 zł/m²,parter/4,3,2013,garaż/miejsce parkingowe,wtórny,pełna własność,,775 zł,miejskie,biuro nieruchomości,nie,"ogródek, taras",brak informacji,brak informacji
https://www.otodom.pl/pl/oferta/rozkladowe-4-pok-z-balkonem-przy-parku-tramwaj-ID4pvqb,"Rozkładowe 4 pok. z balkonem przy Parku, tramwaj","os. Złotego Wieku, Mistrzejowice, Mistrzejowice, Kraków, małopolskie",777 000 zł,56 m²,13 875 zł/m²,3/10,4,1970,garaż/miejsce parkingowe,wtórny,,do zamieszkania,620 zł,miejskie,biuro nieruchomości,tak,balkon,blok,brak informacji
https://www.otodom.pl/pl/oferta/mieszkanie-5-pokojowe-w-okolicy-armii-krajowej-ID4nCmh,Mieszkanie 5 pokojowe w okolicy Armii Krajowej,"ul. Stanisława Przybyszewskiego, Bronowice, Bronowice, Kraków, małopolskie",1 599 000 zł,"151,11 m²",10 582 zł/m²,1/2,5,2023,garaż/miejsce parkingowe,pierwotny,pełna własność,do wykończenia,,inne,biuro nieruchomości,nie,balkon,brak informacji,brak informacji
https://www.otodom.pl/pl/oferta/duze-mieszkanie-z-garazem-i-cz-ogrodu-os-oficerski-ID4oVIU,Duże mieszkanie z garażem i cz.ogrodu/os.Oficerski,"al. płk. Władysława Beliny-Prażmowskiego, Osiedle Oficerskie, Grzegórzki, Kraków, małopolskie",1 799 000 zł,105 m²,17 133 zł/m²,1/1,3,1935,garaż/miejsce parkingowe,wtórny,pełna własność,,300 zł,gazowe,biuro nieruchomości,nie,"balkon, ogródek",brak informacji,cegła
https://www.otodom.pl/pl/oferta/mieszkanie-przy-miasteczku-agh-ID4phLk,Mieszkanie przy miasteczku Agh,"ul. Armii Krajowej, Małe Błonia, Krowodrza, Kraków, małopolskie",570 000 zł,34 m²,16 765 zł/m²,parter/15,2,1968,,wtórny,,do wykończenia,600 zł,miejskie,biuro nieruchomości,nie,,blok,brak informacji
https://www.otodom.pl/pl/oferta/trzypokojowe-mieszkanie-w-kamerlanym-budynku-ID4phNr,Trzypokojowe mieszkanie w kamerlanym budynku,"Zakrzówek, Dębniki, Kraków, małopolskie",800 000 zł,"56,92 m²",14 055 zł/m²,1/3,3,brak informacji,,pierwotny,pełna własność,,,miejskie,biuro nieruchomości,tak,balkon,brak informacji,brak informacji
https://www.otodom.pl/pl/oferta/2pok-gotowe-bez-pcc-bez-prowizji-wysoki-standard-ID4phNF,2pok/gotowe/bez Pcc/bez prowizji/wysoki standard,"ul. Na Błonie, Bronowice, Bronowice, Kraków, małopolskie",794 022 zł,"44,86 m²",17 700 zł/m²,1/2,2,2023,garaż/miejsce parkingowe,pierwotny,pełna własność,,,,biuro nieruchomości,nie,balkon,brak informacji,brak informacji
https://www.otodom.pl/pl/oferta/faktoria-mlyn-lokal-inwestycyjny-b1-b2-p3-lu-8-ID4kFYP,Faktoria Młyn | lokal inwestycyjny B1.B2.P3.LU.8,"ul. Kocmyrzowska, Bieńczyce, Bieńczyce, Kraków, małopolskie",619 986 zł,"42,8 m²",14 486 zł/m²,3/4,1,2024,,pierwotny,pełna własność,do wykończenia,,,deweloper,nie,,brak informacji,brak informacji
https://www.otodom.pl/pl/oferta/mieszkanie-w-centrum-inwestycja-promocja-ID4phU8,Mieszkanie w Centrum | Inwestycja | Promocja!,"ul. Rydlówka, Stare Podgórze, Podgórze, Kraków, małopolskie",708 200 zł,"38,17 m²",18 554 zł/m²,3/4,1,brak informacji,,pierwotny,pełna własność,do wykończenia,,miejskie,biuro nieruchomości,tak,balkon,blok,pustak
https://www.otodom.pl/pl/oferta/urokliwe-mieszkanie-w-nowej-hucie-na-sprzedaz-ID4p2pl,Urokliwe Mieszkanie w Nowej Hucie - Na Sprzedaż,"Nowa Huta, Nowa Huta, Kraków, małopolskie",629 000 zł,"45,1 m²",13 947 zł/m²,3/3,2,1955,garaż/miejsce parkingowe,wtórny,pełna własność,do zamieszkania,"718,76 zł",miejskie,biuro nieruchomości,tak,,blok,cegła
https://www.otodom.pl/pl/oferta/apartament-w-kameralnym-budynku-park-lotnikow-ID4peAT,Apartament w kameralnym budynku – Park Lotników,"ul. Mariana Markowskiego, Czyżyny, Czyżyny, Kraków, małopolskie",780 000 zł,"30,48 m²",25 591 zł/m²,2/4,1,2016,,wtórny,pełna własność,do zamieszkania,,miejskie,biuro nieruchomości,tak,balkon,blok,cegła
https://www.otodom.pl/pl/oferta/3-pokojowe-mieszkanie-z-balkonem-olsza-ID4peOj,3-pokojowe mieszkanie z balkonem - Olsza,"Rakowice, Prądnik Czerwony, Kraków, małopolskie",732 200 zł,"52,3 m²",14 000 zł/m²,3/4,3,1973,,wtórny,,do zamieszkania,,miejskie,biuro nieruchomości,nie,balkon,blok,inny
https://www.otodom.pl/pl/oferta/dominikanow-m23-60-67m2-3-pok-balkon-ID4nOXg,"DOMINIKANÓW / M23 / 60,67m2 / 3 pok. / balkon","ul. Dominikanów, Prądnik Czerwony, Prądnik Czerwony, Kraków, małopolskie",1 019 000 zł,"60,67 m²",16 796 zł/m²,1/4,3,2025,garaż/miejsce parkingowe,pierwotny,pełna własność,do wykończenia,,miejskie,deweloper,tak,balkon,apartamentowiec,żelbet
https://www.otodom.pl/pl/oferta/przestronne-2-pokojowe-rejon-gorki-narodowej-ID4oivf,Przestronne 2-pokojowe - rejon Górki Narodowej!,"al. 29 Listopada, Górka Narodowa, Prądnik Biały, Kraków, małopolskie",649 000 zł,48 m²,13 521 zł/m²,10/10,2,2008,,wtórny,pełna własność,do zamieszkania,,miejskie,biuro nieruchomości,tak,balkon,blok,inny
https://www.otodom.pl/pl/oferta/piekne-mieszkanie-w-zabytkowej-kamienicy-krakow-ID4pg3A,"Piękne mieszkanie w zabytkowej kamienicy, Kraków","ul. Henryka Siemiradzkiego, Piasek, Stare Miasto, Kraków, małopolskie",765 000 zł,27 m²,28 333 zł/m²,parter/3,1,1886,,wtórny,pełna własność,do zamieszkania,220 zł,elektryczne,biuro nieruchomości,nie,ogródek,kamienica,cegła
https://www.otodom.pl/pl/oferta/2-pok-do-wejscia-krowodrza-ID4nTxm,2 pok |do wejścia| krowodrza,"ul. Krowoderskich Zuchów 16, Krowodrza Górka, Prądnik Biały, Kraków, małopolskie",795 000 zł,"49,28 m²",16 132 zł/m²,10/12,2,brak informacji,,wtórny,pełna własność,do zamieszkania,550 zł,miejskie,biuro nieruchomości,tak,balkon,blok,beton
https://www.otodom.pl/pl/oferta/mieszkanie-z-imponujaca-wysokoscia-pomieszczen-ID4kaT9,Mieszkanie z Imponującą Wysokością Pomieszczeń!,"ul. Reduta, Prądnik Czerwony, Prądnik Czerwony, Kraków, małopolskie",1 308 625 zł,"90,25 m²",14 500 zł/m²,parter/5,3,2023,garaż/miejsce parkingowe,pierwotny,pełna własność,,,miejskie,biuro nieruchomości,tak,balkon,brak informacji,brak informacji
https://www.otodom.pl/pl/oferta/pradnik-czerwony-nowa-inwestycja-blisko-parku-ID4osjX,Prądnik czerwony- nowa inwestycja blisko parku,"ul. Reduta, Prądnik Czerwony, Prądnik Czerwony, Kraków, małopolskie",1 347 675 zł,"77,01 m²",17 500 zł/m²,5/5,4,2023,garaż/miejsce parkingowe,pierwotny,pełna własność,,,miejskie,biuro nieruchomości,tak,balkon,brak informacji,brak informacji
https://www.otodom.pl/pl/oferta/krowoderska-3-pokoje-70-m2-balkon-z-widokiem-ID4mXa2,Krowoderska | 3 pokoje | 70 m2 | balkon z widokiem,"ul. Krowoderska, Kleparz, Stare Miasto, Kraków, małopolskie",1 519 000 zł,"70,6 m²",21 516 zł/m²,3/4,3,1936,,wtórny,pełna własność,do zamieszkania,,gazowe,biuro nieruchomości,nie,balkon,kamienica,cegła
https://www.otodom.pl/pl/oferta/wyjatkowy-apartament-w-sercu-krakowa-ID4onkA,Wyjątkowy apartament w sercu Krakowa,"ul. Stolarska, Stare Miasto, Stare Miasto, Kraków, małopolskie",5 970 000 zł,"148,01 m²",40 335 zł/m²,3/3,3,1310,,wtórny,,do zamieszkania,,,biuro nieruchomości,nie,balkon,brak informacji,brak informacji
https://www.otodom.pl/pl/oferta/mieszkanie-w-stanie-deweloperskim-2023-2024-ID4pvbu,Mieszkanie w stanie deweloperskim 2023/2024,"ul. Adama Vetulaniego, Prądnik Biały, Prądnik Biały, Kraków, małopolskie",758 000 zł,"47,24 m²",16 046 zł/m²,5/7,3,2024,garaż/miejsce parkingowe,pierwotny,pełna własność,do wykończenia,300 zł,miejskie,biuro nieruchomości,tak,balkon,blok,brak informacji
https://www.otodom.pl/pl/oferta/mieszkanie-3-pokojowe-ul-banacha-ID4pvbt,Mieszkanie 3 pokojowe ul Banacha,"ul. Stefana Banacha, Górka Narodowa, Prądnik Biały, Kraków, małopolskie",886 000 zł,"55,42 m²",15 987 zł/m²,1/5,3,2018,garaż/miejsce parkingowe,wtórny,pełna własność,do zamieszkania,699 zł,miejskie,biuro nieruchomości,tak,balkon,blok,brak informacji
https://www.otodom.pl/pl/oferta/84-m2-kazimierza-wielkiego-3-pok-kuchnia-ID4oum2,84 m2 | Kazimierza Wielkiego | 3 pok + kuchnia,"ul. Kazimierza Wielkiego, Nowa Wieś, Krowodrza, Kraków, małopolskie",1 299 000 zł,"83,86 m²",15 490 zł/m²,3/4,3,1938,,wtórny,pełna własność,do zamieszkania,500 zł,gazowe,biuro nieruchomości,nie,balkon,kamienica,cegła
https://www.otodom.pl/pl/oferta/sw-wawrzynca-kazimierz-3-pokoje-po-remoncie-ID4mrfz,Św. Wawrzyńca | Kazimierz | 3 pokoje | po remoncie,"Kazimierz, Stare Miasto, Kraków, małopolskie",1 394 000 zł,"65,6 m²",21 250 zł/m²,2/4,3,brak informacji,,wtórny,pełna własność,do zamieszkania,460 zł,gazowe,biuro nieruchomości,nie,,kamienica,cegła
https://www.otodom.pl/pl/oferta/stylowe-rozkladowe-3-pokojowe-mieszkanie-ID4pviE,"Stylowe, rozkładowe 3 pokojowe mieszkanie.","ul. Dobrego Pasterza, Prądnik Czerwony, Prądnik Czerwony, Kraków, małopolskie",785 000 zł,70 m²,11 214 zł/m²,3/3,3,2003,garaż/miejsce parkingowe,wtórny,pełna własność,do zamieszkania,750 zł,miejskie,biuro nieruchomości,nie,,blok,inny
https://www.otodom.pl/pl/oferta/mieszkanie-przy-bulwarach-wislanych-54-m2-ID4nY2i,Mieszkanie przy Bulwarach Wiślanych - 54 m2,"Zwierzyniec, Zwierzyniec, Kraków, małopolskie",1 250 000 zł,"54,2 m²",23 063 zł/m²,2/5,3,2014,,wtórny,pełna własność,do zamieszkania,880 zł,miejskie,biuro nieruchomości,tak,,blok,pustak
https://www.otodom.pl/pl/oferta/brak-pcc-2-pokojowe-ul-walerego-slawka-ID4ofS4,Brak Pcc ~ 2 pokojowe ~ ul. Walerego Sławka,"ul. Walerego Sławka, Wola Duchacka, Podgórze Duchackie, Kraków, małopolskie",683 294 zł,"38,17 m²",17 901 zł/m²,8/8,2,brak informacji,garaż/miejsce parkingowe,wtórny,pełna własność,,,miejskie,biuro nieruchomości,tak,balkon,blok,brak informacji
https://www.otodom.pl/pl/oferta/brak-pcc-4-pokojowe-ul-walerego-slawka-ID4ofS5,Brak Pcc ~ 4 pokojowe ~ ul. Walerego Sławka,"ul. Walerego Sławka, Wola Duchacka, Podgórze Duchackie, Kraków, małopolskie",1 000 017 zł,"68,86 m²",14 522 zł/m²,2/8,4,brak informacji,garaż/miejsce parkingowe,wtórny,pełna własność,,,miejskie,biuro nieruchomości,tak,,blok,brak informacji
https://www.otodom.pl/pl/oferta/mistrzejowice-3-pokoje-do-wejscia-8-pietro-ID4olda,Mistrzejowice | 3 pokoje | Do wejścia | 8 piętro,"os. Kombatantów, Mistrzejowice, Mistrzejowice, Kraków, małopolskie",710 000 zł,"47,43 m²",14 969 zł/m²,8/10,3,1982,garaż/miejsce parkingowe,wtórny,pełna własność,do zamieszkania,720 zł,miejskie,biuro nieruchomości,tak,balkon,blok,wielka płyta
https://www.otodom.pl/pl/oferta/jednopokojowe-kawalerka-na-sprzedaz-ID4oPdU,Jednopokojowe kawalerka na sprzedaż,"ul. Walerego Sławka, Wola Duchacka, Podgórze Duchackie, Kraków, małopolskie",350 000 zł,"28,35 m²",12 346 zł/m²,1/1,1,brak informacji,,wtórny,,,30 zł,,biuro nieruchomości,nie,,brak informacji,brak informacji
https://www.otodom.pl/pl/oferta/3pokojowe-oddzielna-jasna-kuchnia-balkon-bronowice-ID4oPwU,3Pokojowe-Oddzielna Jasna Kuchnia-Balkon-Bronowice,"Bronowice, Bronowice, Kraków, małopolskie",769 000 zł,"54,86 m²",14 017 zł/m²,6/10,3,1974,,wtórny,,,550 zł,miejskie,biuro nieruchomości,tak,balkon,blok,brak informacji
https://www.otodom.pl/pl/oferta/stare-miasto-plac-kossaka-6-pokoi-winda-balkon-ID4oPzt,"Stare Miasto - Plac Kossaka, 6 pokoi,winda, balkon","pl. Juliusza Kossaka, Nowy Świat, Stare Miasto, Kraków, małopolskie",3 999 000 zł,159 m²,25 151 zł/m²,2/4,6,1920,,wtórny,pełna własność,do zamieszkania,,miejskie,biuro nieruchomości,tak,balkon,kamienica,cegła
https://www.otodom.pl/pl/oferta/apartament-w-prestizowej-inwestycji-ID4oPCD,Apartament w prestiżowej inwestycji.,"ul. Masarska, Grzegórzki, Grzegórzki, Kraków, małopolskie",1 365 000 zł,"61,12 m²",22 333 zł/m²,2/5,5,2020,garaż/miejsce parkingowe,pierwotny,,do wykończenia,,miejskie,biuro nieruchomości,tak,"balkon, ogródek",apartamentowiec,brak informacji
https://www.otodom.pl/pl/oferta/3-pokoje-po-generalnym-remoncie-na-kazimierzu-ID4oPCQ,3 pokoje po generalnym remoncie na Kazimierzu,"ul. św. Wawrzyńca, Kazimierz, Stare Miasto, Kraków, małopolskie",1 394 000 zł,65 m²,21 446 zł/m²,2,3,1933,,wtórny,,do zamieszkania,,gazowe,biuro nieruchomości,nie,,brak informacji,brak informacji
https://www.otodom.pl/pl/oferta/idealne-mieszkanie-duzy-balkon-okazja-ID4phXk,Idealne Mieszkanie | Duży balkon | Okazja!,"ul. Rydlówka, Stare Podgórze, Podgórze, Kraków, małopolskie",827 400 zł,"42,88 m²",19 296 zł/m²,5/5,2,brak informacji,,pierwotny,pełna własność,do wykończenia,,miejskie,biuro nieruchomości,tak,balkon,blok,pustak
https://www.otodom.pl/pl/oferta/mieszkanie-inwestycyjne-okazjonalna-cena-ID4phXl,Mieszkanie inwestycyjne | Okazjonalna Cena,"ul. Rydlówka, Stare Podgórze, Podgórze, Kraków, małopolskie",752 500 zł,"39,85 m²",18 883 zł/m²,4/4,2,brak informacji,,pierwotny,pełna własność,do wykończenia,,miejskie,biuro nieruchomości,tak,balkon,blok,pustak
https://www.otodom.pl/pl/oferta/mieszkanie-siewna-ID4pi2s,Mieszkanie Siewna,"ul. Siewna, Prądnik Biały, Prądnik Biały, Kraków, małopolskie",750 000 zł,"42,97 m²",17 454 zł/m²,2/7,2,2022,,wtórny,pełna własność,do zamieszkania,500 zł,miejskie,prywatny,tak,balkon,blok,żelbet
https://www.otodom.pl/pl/oferta/mieszkanie-w-kameralnej-inwestycji-ID4opST,Mieszkanie w kameralnej inwestycji!,"ul. Królowej Jadwigi, Wola Justowska, Zwierzyniec, Kraków, małopolskie",2 292 000 zł,"135,21 m²",16 951 zł/m²,parter/1,4,2024,,pierwotny,,do wykończenia,,inne,biuro nieruchomości,nie,"ogródek, taras",blok,pustak
https://www.otodom.pl/pl/oferta/mieszkanie-4pokojowe-ul-stachowicza-scisle-centrum-ID4pi6O,Mieszkanie 4pokojowe ul.Stachowicza ŚCISŁE CENTRUM,"Krowodrza, Krowodrza, Kraków, małopolskie",1 299 000 zł,"69,95 m²",18 570 zł/m²,3/4,4,brak informacji,,wtórny,pełna własność,do zamieszkania,610 zł,gazowe,prywatny,tak,,kamienica,cegła
https://www.otodom.pl/pl/oferta/faktoria-mlyn-mieszkanie-2-pok-b3-p1-m1-ID4kDHy,Faktoria Młyn | mieszkanie 2-pok. | B3.P1.M1,"ul. Kocmyrzowska, Bieńczyce, Bieńczyce, Kraków, małopolskie",838 772 zł,"55,84 m²",15 021 zł/m²,1/2,2,2024,,pierwotny,pełna własność,do wykończenia,,,deweloper,nie,,brak informacji,brak informacji
https://www.otodom.pl/pl/oferta/4-pokojowe-mieszkanie-75m2-balkon-bez-prowizji-ID4ni9Q,4-pokojowe mieszkanie 75m2 + balkon Bez Prowizji,"ul. Josepha Conrada, Azory, Prądnik Biały, Kraków, małopolskie",1 037 127 zł,"75,98 m²",13 650 zł/m²,1/5,4,,garaż/miejsce parkingowe,,pełna własność,do wykończenia,,,,,balkon,,
https://www.otodom.pl/pl/oferta/2-pokoje-45-m2-nowe-osiedle-zlocien-ID4pozY,2 pokoje | 45 m2 | nowe osiedle | Złocień,"ul. Mariana Domagały, Złocień, Bieżanów-Prokocim, Kraków, małopolskie",580 000 zł,"44,86 m²",12 929 zł/m²,1/3,2,2021,garaż/miejsce parkingowe,pierwotny,pełna własność,do wykończenia,350 zł,miejskie,biuro nieruchomości,nie,balkon,apartamentowiec,cegła
https://www.otodom.pl/pl/oferta/kawalerka-debniki-panorama-miasta-32-07-centrum-ID4oSq4,Kawalerka/Dębniki/Panorama Miasta/32.07/Centrum,"ul. Michała Bałuckiego, Dębniki, Dębniki, Kraków, małopolskie",640 000 zł,"32,07 m²",19 956 zł/m²,5/5,1,brak informacji,garaż/miejsce parkingowe,wtórny,pełna własność,,700 zł,,biuro nieruchomości,nie,,brak informacji,brak informacji
https://www.otodom.pl/pl/oferta/2-poziomowe-miej-parking-stan-deweloperski-ID4poB8,2 Poziomowe|Miej. Parking.|Stan Deweloperski,"ul. Lublańska, Prądnik Czerwony, Prądnik Czerwony, Kraków, małopolskie",1 100 000 zł,80 m²,13 750 zł/m²,3/4,4,2023,garaż/miejsce parkingowe,wtórny,pełna własność,do wykończenia,450 zł,miejskie,biuro nieruchomości,tak,balkon,brak informacji,brak informacji
https://www.otodom.pl/pl/oferta/nowoczesne-2-pok-mieszkanie-river-lane-eng-below-ID4ntRC,Nowoczesne 2-pok mieszkanie River Lane - Eng below,"ul. Piotra Borowego, Zwierzyniec, Zwierzyniec, Kraków, małopolskie",995 000 zł,"45,77 m²",21 739 zł/m²,2/3,2,2020,garaż/miejsce parkingowe,wtórny,pełna własność,do zamieszkania,600 zł,miejskie,biuro nieruchomości,tak,"balkon, ogródek, taras",apartamentowiec,pustak
https://www.otodom.pl/pl/oferta/50-m2-osobna-kuchnia-jasne-mieszkanie-zobacz-ID4pgGv,50 m2 | osobna kuchnia | jasne mieszkanie | zobacz,"ul. Turniejowa, Kurdwanów, Podgórze Duchackie, Kraków, małopolskie",675 000 zł,"49,93 m²",13 519 zł/m²,2/5,2,2003,garaż/miejsce parkingowe,wtórny,pełna własność,do zamieszkania,596 zł,miejskie,biuro nieruchomości,tak,balkon,blok,pustak
https://www.otodom.pl/pl/oferta/mieszkanie-36-m-krakow-ID4phfU,"Mieszkanie, 36 m², Kraków","Nowa Huta, Nowa Huta, Kraków, małopolskie",520 000 zł,36 m²,14 444 zł/m²,2/3,1,1952,,wtórny,,,417 zł,miejskie,biuro nieruchomości,nie,,blok,cegła
https://www.otodom.pl/pl/oferta/gotowiec-inwestycyjny-w-centrum-krakowa-ID4phfz,Gotowiec inwestycyjny w centrum Krakowa,"Stare Miasto, Stare Miasto, Kraków, małopolskie",578 000 zł,"20,12 m²",28 728 zł/m²,parter/4,1,brak informacji,,wtórny,pełna własność,do zamieszkania,200 zł,miejskie,biuro nieruchomości,nie,,kamienica,cegła
https://www.otodom.pl/pl/oferta/kawalerka-przy-kladce-bernatka-bez-posrednikow-ID4o7ZS,Kawalerka przy Kładce Bernatka - BEZ POŚREDNIKÓW,"ul. Krakusa, Stare Podgórze, Podgórze, Kraków, małopolskie",470 000 zł,31 m²,15 161 zł/m²,3/3,1,1930,,wtórny,pełna własność,do zamieszkania,185 zł,elektryczne,prywatny,nie,,kamienica,cegła
https://www.otodom.pl/pl/oferta/2-pokojowe-45m2-balkon-bezposrednio-bezczynszowe-ID4hoLZ,"2-pokojowe, 45m2,balkon,bezpośrednio, bezczynszowe","ul. Bronisława Włodarczyka, Czyżyny, Czyżyny, Kraków, małopolskie",599 000 zł,"45,08 m²",13 287 zł/m²,2/4,2,2023,garaż/miejsce parkingowe,pierwotny,pełna własność,do wykończenia,,gazowe,prywatny,nie,balkon,blok,pustak
https://www.otodom.pl/pl/oferta/3-pokojowe-bronowice-pl-ru-ukr-ID4oyGj,3-pokojowe | Bronowice| PL RU UKR,"ul. Tadeusza Makowskiego, Azory, Prądnik Biały, Kraków, małopolskie",670 000 zł,49 m²,13 673 zł/m²,1/4,3,1980,garaż/miejsce parkingowe,wtórny,pełna własność,do zamieszkania,700 zł,miejskie,biuro nieruchomości,nie,,blok,brak informacji
https://www.otodom.pl/pl/oferta/4-pok-dwupoziomowe-94-54m-taras-100m-bez-pcc-ID4hoLJ,"4-pok dwupoziomowe,94,54m,taras 100m, bez PCC","Czyżyny, Czyżyny, Kraków, małopolskie",1 229 000 zł,"94,54 m²",13 000 zł/m²,4/4,4,2023,garaż/miejsce parkingowe,pierwotny,pełna własność,do wykończenia,,gazowe,prywatny,nie,balkon,blok,pustak
https://www.otodom.pl/pl/oferta/2-pokojowe-ID4oF0q,2-pokojowe |,"ul. Gaik, Tonie, Prądnik Biały, Kraków, małopolskie",677 000 zł,"37,64 m²",17 986 zł/m²,parter/1,2,2021,garaż/miejsce parkingowe,wtórny,pełna własność,do zamieszkania,90 zł,gazowe,biuro nieruchomości,nie,ogródek,blok,brak informacji
https://www.otodom.pl/pl/oferta/2-pokojowe-rozkladowe-mogilska-cystersow-ID4paKm,2-pokojowe rozkładowe| Mogilska Cystersów,"ul. Cystersów, Grzegórzki, Grzegórzki, Kraków, małopolskie",725 000 zł,42 m²,17 262 zł/m²,8/8,2,1970,garaż/miejsce parkingowe,wtórny,pełna własność,do zamieszkania,500 zł,miejskie,biuro nieruchomości,tak,,blok,brak informacji
https://www.otodom.pl/pl/oferta/przestronne-mieszkanie-w-doskonalej-lokalizacji-ID4pcHd,Przestronne mieszkanie w doskonałej lokalizacji!,"Osiedle Piastów, Mistrzejowice, Mistrzejowice, Kraków, małopolskie",730 000 zł,57 m²,12 807 zł/m²,4/4,3,1974,garaż/miejsce parkingowe,wtórny,pełna własność,do zamieszkania,825 zł,miejskie,biuro nieruchomości,nie,,blok,wielka płyta
https://www.otodom.pl/pl/oferta/3-pokoje-jasna-kuchnia-do-wlasnej-aranzacji-ID4pivc,3 pokoje + jasna kuchnia do własnej aranżacji!,"os. Jagiellońskie, Bieńczyce, Bieńczyce, Kraków, małopolskie",640 000 zł,56 m²,11 429 zł/m²,parter/10,3,1970,garaż/miejsce parkingowe,wtórny,spółdzielcze wł. prawo do lokalu,do wykończenia,600 zł,miejskie,biuro nieruchomości,tak,,blok,brak informacji
https://www.otodom.pl/pl/oferta/rozkladowe-z-pieknym-widokiem-przy-parku-ID4pe0e,Rozkładowe z pięknym widokiem przy parku!,"ul. Wawelska, Mistrzejowice, Mistrzejowice, Kraków, małopolskie",777 000 zł,56 m²,13 875 zł/m²,3/10,4,1970,garaż/miejsce parkingowe,wtórny,spółdzielcze wł. prawo do lokalu,do wykończenia,620 zł,miejskie,biuro nieruchomości,tak,balkon,blok,wielka płyta
https://www.otodom.pl/pl/oferta/przestronne-2-pokojowe-mieszkanie-w-czyzynach-ID4oGVd,Przestronne 2-pokojowe mieszkanie w Czyżynach,"Osiedle Dywizjonu 303, Czyżyny, Czyżyny, Kraków, małopolskie",690 000 zł,50 m²,13 800 zł/m²,2/10,2,1982,garaż/miejsce parkingowe,wtórny,pełna własność,do wykończenia,650 zł,miejskie,biuro nieruchomości,tak,balkon,blok,brak informacji
https://www.otodom.pl/pl/oferta/soltysowska-do-zamieszkania-2-pokoje-aktualne-ID4nWwQ,Sołtysowska do zamieszkania 2 pokoje aktualne,"ul. Sołtysowska, Łęg, Czyżyny, Kraków, małopolskie",720 000 zł,50 m²,14 400 zł/m²,2/5,2,2011,garaż/miejsce parkingowe,wtórny,pełna własność,do zamieszkania,690 zł,miejskie,biuro nieruchomości,tak,balkon,blok,cegła
https://www.otodom.pl/pl/oferta/kawalerka-do-wlasnej-aranzacji-ID4ozPa,Kawalerka do własnej aranżacji,"ul. Żywiecka, Ruczaj, Dębniki, Kraków, małopolskie",155 000 zł,"13,4 m²",11 567 zł/m²,2/2,1,2024,,wtórny,udział,do wykończenia,2 zł,,biuro nieruchomości,nie,,blok,brak informacji
https://www.otodom.pl/pl/oferta/okazyjnie-3-pokojowe-os-albertynskie-ID4pjs3,Okazyjnie 3 pokojowe os Albertyńskie,"ul. Małego Księcia, Bieńczyce, Bieńczyce, Kraków, małopolskie",540 000 zł,44 m²,12 273 zł/m²,4/4,3,1978,garaż/miejsce parkingowe,wtórny,pełna własność,,543 zł,miejskie,biuro nieruchomości,nie,,blok,brak informacji
https://www.otodom.pl/pl/oferta/dwupokojowe-mieszkanie-na-zablociu-ID4ptdy,Dwupokojowe mieszkanie na Zabłociu,"Zabłocie, Podgórze, Kraków, małopolskie",850 000 zł,"45,69 m²",18 604 zł/m²,2/5,2,brak informacji,,pierwotny,pełna własność,,,miejskie,biuro nieruchomości,tak,balkon,brak informacji,brak informacji
https://www.otodom.pl/pl/oferta/kawalerka-kazimierz-tuz-obok-bulwary-wislany-ID4ptea,Kawalerka Kazimierz tuż obok Bulwary Wiślany,"Stare Miasto, Stare Miasto, Kraków, małopolskie",595 000 zł,23 m²,25 870 zł/m²,1/3,1,1950,,wtórny,pełna własność,do zamieszkania,490 zł,kotłownia,biuro nieruchomości,nie,balkon,kamienica,cegła
https://www.otodom.pl/pl/oferta/trzypokojowe-mieszkanie-na-zablociu-ID4pbSe,Trzypokojowe mieszkanie na Zabłociu,"Zabłocie, Podgórze, Kraków, małopolskie",1 141 000 zł,"57,05 m²",20 000 zł/m²,4/5,3,brak informacji,,pierwotny,pełna własność,,,miejskie,biuro nieruchomości,tak,balkon,brak informacji,brak informacji
https://www.otodom.pl/pl/oferta/czteropokojowe-mieszkanie-na-zablociu-ID4pbSd,Czteropokojowe mieszkanie na Zabłociu,"Zabłocie, Podgórze, Kraków, małopolskie",1 250 000 zł,"67,8 m²",18 437 zł/m²,1/5,4,brak informacji,,pierwotny,pełna własność,,,miejskie,biuro nieruchomości,tak,balkon,brak informacji,brak informacji
https://www.otodom.pl/pl/oferta/al-kijowska-mieszkanie-do-sprzedania-ID4pbYZ,Al. Kijowska / mieszkanie do sprzedania,"al. Kijowska, Łobzów, Krowodrza, Kraków, małopolskie",1 233 900 zł,"91,4 m²",13 500 zł/m²,1/11,4,1993,,wtórny,pełna własność,do zamieszkania,,,biuro nieruchomości,nie,balkon,brak informacji,brak informacji
https://www.otodom.pl/pl/oferta/faktoria-mlyn-mieszkanie-3-pok-b1-b2-p1-m8-ID4kDGA,Faktoria Młyn | mieszkanie 3-pok. | B1.B2.P1.M8,"ul. Kocmyrzowska, Bieńczyce, Bieńczyce, Kraków, małopolskie",926 013 zł,"60,5 m²",15 306 zł/m²,1/4,3,2024,,pierwotny,pełna własność,do wykończenia,,,deweloper,nie,,brak informacji,brak informacji
https://www.otodom.pl/pl/oferta/polowa-domu-blizniaczego-125-m2-ogrod-143-m2-ID4p12p,Połowa domu bliźniaczego 125 m2 + ogród 143 m2,"ul. Wiosenna, Chełm, Zwierzyniec, Kraków, małopolskie",2 184 700 zł,125 m²,17 478 zł/m²,,4,brak informacji,,pierwotny,,,,,biuro nieruchomości,nie,ogródek,brak informacji,brak informacji
https://www.otodom.pl/pl/oferta/luksusowy-apartament-w-stylu-glamour-ID4o0mT,Luksusowy apartament w stylu glamour,"ul. Wrocławska, Krowodrza, Krowodrza, Kraków, małopolskie",835 000 zł,"44,79 m²",18 643 zł/m²,parter/6,2,2022,garaż/miejsce parkingowe,wtórny,pełna własność,do zamieszkania,765 zł,miejskie,biuro nieruchomości,tak,"ogródek, taras",apartamentowiec,cegła
https://www.otodom.pl/pl/oferta/mieszkanie-19-54-m-krakow-ID4o0Vt,"Mieszkanie, 19,54 m², Kraków","ul. św. Sebastiana, Kazimierz, Stare Miasto, Kraków, małopolskie",584 000 zł,"19,54 m²",29 887 zł/m²,2/3,1,1896,,wtórny,pełna własność,do zamieszkania,220 zł,miejskie,biuro nieruchomości,nie,,blok,cegła
https://www.otodom.pl/pl/oferta/2-pokoje-swietna-lokalizacja-widok-na-park-ID4plHX,2 pokoje | świetna lokalizacja | widok na park,"Aleja Jana Pawła II, Nowa Huta, Nowa Huta, Kraków, małopolskie",836 325 zł,"47,25 m²",17 700 zł/m²,4/4,2,2024,garaż/miejsce parkingowe,pierwotny,pełna własność,do wykończenia,,miejskie,biuro nieruchomości,tak,balkon,blok,inny
